{
  "id": "x-2105170431577870682",
  "slug": "beige-autumn",
  "modelClaimed": "GPT Image 2.5",
  "title": {
    "en": "Noble-Beige Quiet Luxury Autumn Editorial",
    "zh": "贵族米色秋日艺术画页"
  },
  "description": {
    "en": "Intimate autumn memory on luxury art-book paper, using soft gouache dry-brush rendering and generous ivory negative space.",
    "zh": "用柔和水粉、干笔肌理与中性色衣装，呈现留白丰富的秋日片刻。"
  },
  "author": {
    "name": "Saul Goodman",
    "handle": "Goodmanprotocol"
  },
  "sourceUrl": "https://x.com/Goodmanprotocol/status/2105170431577870682",
  "originalLanguage": "en",
  "originalPrompt": "Create a premium 4:5 vertical noble-beige autumn editorial artwork for [COUNTRY / LOCATION / SUBJECT].\n\nTEXT-TO-IMAGE ONLY — generate the entire artwork creatively from [COUNTRY / LOCATION / SUBJECT] alone. No reference image required.\n\nCORE CONCEPT\nCreate a small, intimate autumn moment surrounded by generous warm ivory negative space, as if a precious fragment of an autumn memory has been painted onto a luxury art-book page. Automatically determine the most fitting human figure, setting, foliage, atmosphere, and seasonal details associated with [COUNTRY / LOCATION / SUBJECT].\n\nSUBJECT & WARDROBE\nPlace one elegant human figure within the scene, wearing understated Italian quiet-luxury autumn clothing: soft cashmere, fine wool, brushed suede, or refined natural fabrics with relaxed tailoring.\n\nUse a sophisticated tonal wardrobe of ivory, cream, oatmeal, sand, camel, cappuccino, taupe, and soft greige. Keep the styling effortless, timeless, minimal, and free of visible branding or logos.\n\nARTISTIC STYLE\nRender the scene as delicate soft gouache and sophisticated dry-brush painting with subtle handmade texture, translucent tonal transitions, softly unfinished edges, and gentle color fading into the surrounding ivory paper.\n\nKeep the human figure more refined and visually defined than the surrounding painterly environment, while maintaining a natural, understated appearance.\n\nCOLOR PALETTE\nBuild the entire artwork around noble beige and warm neutral tones: warm ivory, ecru, parchment, cashmere beige, oatmeal, sand, biscuit, light camel, mushroom, greige, and warm taupe.\n\nUse only restrained accents of muted chocolate, dusty olive, or softly browned foliage. Avoid strong orange, red, yellow, or rustic autumn colors.\n\nAUTUMN DETAILS\nAdd only a few delicate autumn leaves and understated foliage. Let several pale beige or muted ochre leaves subtly extend beyond the painted scene into the surrounding negative space.\n\nLIGHTING\nUse soft diffused creamy light with a slightly luminous quality, gentle contrast, and no harsh shadows. Emphasize tactile natural fabrics, quiet atmosphere, and sophisticated tonal harmony.\n\nFINAL AESTHETIC\nLuxury art-book page × noble beige autumn painting × soft gouache × Italian quiet luxury × cashmere-like tonal harmony × minimalist editorial composition.\n\nThe result should feel serene, intimate, expensive, tactile, collectible, and timeless.\n\nAvoid photorealism, saturated autumn colors, rustic styling, excessive foliage, harsh contrast, heavy shadows, excessive accessories, busy backgrounds, collage layouts, hard frames, logos, text, watermarks, or artificial 3D rendering.\n\nFORMAT: 4:5 vertical, generous warm-ivory negative space, refined minimalist composition.",
  "translations": {},
  "promptKind": "text-to-image",
  "inputRequirement": "No reference image required.",
  "categories": {
    "use": [
      "art-editorial"
    ],
    "style": [
      "gouache",
      "minimalist"
    ],
    "subject": [
      "people",
      "autumn"
    ]
  },
  "tags": [
    "Quiet Luxury",
    "Soft Gouache",
    "Autumn Palette",
    "Editorial"
  ],
  "media": [
    {
      "url": "https://pbs.twimg.com/media/HTcRTt-bAAASV7r?format=webp&name=large",
      "role": "output",
      "alt": "Original artwork 1 by @Goodmanprotocol",
      "sourceUrl": "https://x.com/Goodmanprotocol/status/2105170431577870682"
    },
    {
      "url": "https://pbs.twimg.com/media/HTcRUaSa0AAakLN.jpg",
      "role": "output",
      "alt": "Original artwork 2 by @Goodmanprotocol",
      "sourceUrl": "https://x.com/Goodmanprotocol/status/2105170431577870682"
    },
    {
      "url": "https://pbs.twimg.com/media/HTcRVJwbMAABlDz.jpg",
      "role": "output",
      "alt": "Original artwork 3 by @Goodmanprotocol",
      "sourceUrl": "https://x.com/Goodmanprotocol/status/2105170431577870682"
    },
    {
      "url": "https://pbs.twimg.com/media/HTcRV9maQAATIo8.jpg",
      "role": "output",
      "alt": "Original artwork 4 by @Goodmanprotocol",
      "sourceUrl": "https://x.com/Goodmanprotocol/status/2105170431577870682"
    }
  ],
  "rights": {
    "basis": "third-party-source",
    "note": "Original prompts and artwork belong to their respective authors. Public source links; no blanket reuse license is granted."
  }
}
