{
  "id": "x-2105563629454348547",
  "slug": "pink-watercolor-fashion-portrait",
  "modelClaimed": "GPT Image 2.5",
  "title": {
    "en": "Pastel Pink Watercolor Fashion Portrait",
    "zh": "粉色水彩时装人像"
  },
  "description": {
    "en": "Use a portrait reference for a pink-jacket fashion illustration with a guitar-like instrument, translucent watercolor and fine ink details.",
    "zh": "以人物参考图绘制粉色外套时装插画，结合吉他形乐器、透明水彩层次和细墨线细节。"
  },
  "author": {
    "name": "Gopal Tiwari",
    "handle": "imGopalTiwari"
  },
  "sourceUrl": "https://x.com/imGopalTiwari/status/2105563629454348547",
  "originalLanguage": "en",
  "originalPrompt": "Hyper-realistic IMAX-level Netflix-style watercolor fashion illustration, 9:16 vertical. Use the uploaded image as the primary visual reference and preserve the exact facial identity, proportions, and defining features. Create a woman wearing a dusty-pink cropped jacket over a ribbed pink fitted top with a dark inner layer at the neckline, distressed blue short jeans and layered bracelets, standing upright with a relaxed slight lean, her torso facing mostly toward the viewer, left arm hanging naturally beside her thigh while her right arm bends forward and her right hand grips the neck of a guitar-like instrument crossing horizontally in front of her waist; her shoulders stay relaxed and her stance feels casual and confident. Her face tilts slightly upward and toward the camera with a bright gentle smile, softly raised cheeks, relaxed eyes looking directly forward, naturally lifted brows, relaxed jaw and softly closed lips, giving her a cheerful, warm and carefree expression. Her medium-length dark-brown hair is worn loose with a slightly messy natural texture, soft waves and uneven flowing strands around the shoulders, a loose center-to-slight-side part, wispy strands crossing the forehead and several fine flyaways extending outward to create an airy hand-painted movement. Fair luminous porcelain skin with a bright ivory to light beige tone and a neutral-cool undertone, rendered with delicate watercolor texture and soft translucent blush on the cheeks. Keep the background mostly white textured watercolor paper with a large irregular pale peach-pink watercolor wash behind the figure, with softly feathered edges and a few scattered paint splashes. Use gentle diffuse illustrated lighting with soft highlights along the face, hair and jacket and very subtle shadow washes beneath the chin, hair and clothing folds. Colour grade with a soft pastel palette of blush pink, dusty rose, muted blue, warm beige and clean ivory, low contrast, delicate saturation, creamy highlights and very light grey shadows. Apply a refined watercolor-and-fine-ink filter with visible paper grain, translucent layered pigment, soft pigment bleeding, delicate brush edges, subtle ink outlines and natural colour variation while keeping the face and important details clean and expressive.  \nNegative prompt: changed identity, distorted anatomy, extra fingers, malformed hands, broken instrument, harsh digital rendering, photorealistic skin, 3D CGI, muddy colours, text, watermark.",
  "translations": {},
  "promptKind": "image-editing",
  "inputRequirement": "Upload the primary portrait reference; preserve its facial identity, proportions and defining features.",
  "categories": {
    "use": [
      "image-editing",
      "fashion-editorial"
    ],
    "style": [
      "watercolor"
    ],
    "subject": [
      "people",
      "fashion",
      "music"
    ]
  },
  "tags": [
    "Pastel palette",
    "Watercolor paper",
    "Fashion illustration"
  ],
  "media": [
    {
      "url": "https://pbs.twimg.com/media/HTh28H2bcAAGBT8.jpg",
      "role": "output",
      "alt": "Original artwork 1 by @imGopalTiwari",
      "sourceUrl": "https://x.com/imGopalTiwari/status/2105563629454348547"
    }
  ],
  "rights": {
    "basis": "third-party-source",
    "note": "Original prompts and artwork belong to their respective authors. Public source links; no blanket reuse license is granted."
  }
}
