{
  "id": "x-2104185048652255275",
  "slug": "motocross-wheelie-comic-poster",
  "modelClaimed": "GPT Image 2.5",
  "title": {
    "en": "Low-Angle Motocross Wheelie Illustration",
    "zh": "低机位越野摩托翘头插画"
  },
  "description": {
    "en": "A front-facing wheelie with an oversized foreground tire, rough black linework and a vivid red-orange comic poster palette.",
    "zh": "从极低正面机位描绘越野摩托翘头动作，以巨大的前轮、粗黑线条和鲜明红橙色呈现漫画海报张力。"
  },
  "author": {
    "name": "Harboris",
    "handle": "harboriis"
  },
  "sourceUrl": "https://x.com/harboriis/status/2104185048652255275",
  "originalLanguage": "en",
  "originalPrompt": "Create a high-impact vertical editorial illustration of a motocross rider performing an aggressive wheelie directly toward the camera on a dirt bike. Use an extremely low front-facing camera angle, making the large front knobby tire dominate the lower-right foreground while the rider appears powerful and imposing above it.\n\nThe rider wears a full motocross helmet with a dark tinted visor, protective motocross jersey, padded riding pants, gloves, and rugged motocross boots. Show realistic protective gear with layered fabric, stitching, armor panels, folds, scratches, and worn textures. \n\nThe motorcycle should have detailed handlebars, handguards, front suspension forks, spokes, brake components, engine parts, frame, mudguards, and thick off-road tires.\n\nUse a bold graphic comic-book illustration style with heavy black ink outlines, rough hand-drawn linework, crosshatching, imperfect ink edges, expressive contour lines, subtle paper grain, and screen-print-like texture. Use a limited high-contrast palette of vivid red-orange, black, cream, muted yellow, and warm gray.\n\nThe background is a flat intense red-orange field with subtle geometric color variation, distressed paint texture, scattered black dirt particles, and small debris around the motorcycle. Add a dusty ground surface beneath the bike with splashes of dirt and gritty texture.\nDynamic action composition, dramatic perspective, exaggerated scale, crisp illustrated details, strong shadows, vintage motocross poster aesthetic, modern editorial graphic design, energetic and rebellious mood.\n\nNo text, no letters, no numbers, no logos, no usernames, no watermark, no signature, no typography anywhere in the image.\n\nVertical 4:5 composition.",
  "translations": {},
  "promptKind": "text-to-image",
  "inputRequirement": "No reference image required.",
  "categories": {
    "use": [
      "posters"
    ],
    "style": [
      "comic",
      "hand-drawn",
      "retro"
    ],
    "subject": [
      "sports",
      "vehicles",
      "people"
    ]
  },
  "tags": [
    "Dynamic perspective",
    "Motocross",
    "Screen-print texture"
  ],
  "media": [
    {
      "url": "https://pbs.twimg.com/media/HTORDWca4AAjQnO.jpg",
      "role": "output",
      "alt": "Original artwork 1 by @harboriis",
      "sourceUrl": "https://x.com/harboriis/status/2104185048652255275"
    },
    {
      "url": "https://pbs.twimg.com/media/HTORFrdaYAA_wa4.jpg",
      "role": "output",
      "alt": "Original artwork 2 by @harboriis",
      "sourceUrl": "https://x.com/harboriis/status/2104185048652255275"
    },
    {
      "url": "https://pbs.twimg.com/media/HTORG2AaEAAGAry.jpg",
      "role": "output",
      "alt": "Original artwork 3 by @harboriis",
      "sourceUrl": "https://x.com/harboriis/status/2104185048652255275"
    },
    {
      "url": "https://pbs.twimg.com/media/HTORH3nbAAAGRmX.jpg",
      "role": "output",
      "alt": "Original artwork 4 by @harboriis",
      "sourceUrl": "https://x.com/harboriis/status/2104185048652255275"
    }
  ],
  "rights": {
    "basis": "third-party-source",
    "note": "Original prompts and artwork belong to their respective authors. Public source links; no blanket reuse license is granted."
  }
}
