{
  "id": "x-2104927737014329524",
  "slug": "italian-fashion",
  "modelClaimed": "GPT Image 2.5",
  "title": {
    "en": "1960s Italian Street Fashion Editorial with Vespa & Sidecar",
    "zh": "意大利复古街头时装大片"
  },
  "description": {
    "en": "Photorealistic European café street editorial featuring an extravagant icy-blue ruffled dress and yellow sidecar scooter.",
    "zh": "蓝色高级定制礼服、黄色边车与欧洲咖啡馆，结合直闪与暖色环境光。"
  },
  "author": {
    "name": "Meem",
    "handle": "mehvishs25"
  },
  "sourceUrl": "https://x.com/mehvishs25/status/2104927737014329524",
  "originalLanguage": "en",
  "originalPrompt": "Create a photorealistic high-fashion street photograph set on a charming European café street, styled like a surreal yet believable 1960s Italian fashion editorial.\n\nA young adult woman is seated gracefully along the edge of a vintage powder-blue Vespa-inspired scooter. Attached to the scooter is an unusually large, highly polished canary-yellow sidecar, creating a bold pop of color and an eccentric fashion-editorial focal point.\n\nShe wears an extravagant icy-blue couture midi dress constructed from layers of sculptural 3D ruffles, delicate shredded tulle, feather-like fabric petals, translucent organza strips, and subtle dark decorative accents. The silhouette is intentionally oversized and cloud-like, with a dramatic neckline and exaggerated architectural shoulders. The outfit should feel luxurious, theatrical, and unmistakably haute couture rather than costume-like.\n\nHer styling is distinctly retro-glamorous: sleek jet-black hair pulled into a perfectly smooth low bun with a precise center part, porcelain-toned skin, sharply defined brows, dramatic black winged eyeliner, and intensely vivid matte-red lipstick. Oversized white cat-eye sunglasses with deep black lenses complete the look.\n\nAccessories include a structured emerald-green handbag and striking yellow pointed-toe stiletto pumps featuring refined black detailing.\n\nHer pose is elegant and controlled, with a sophisticated, slightly aloof expression. Capture her entire figure naturally within the frame, emphasizing the dramatic proportions of the couture silhouette and the unusual scooter-sidecar combination.\n\nThe setting is an authentic old European café with dark wooden window frames, weathered beige plaster walls, gingham-covered outdoor tables, and a vintage red “CAFE” sign. Warm amber illumination spills from inside the café, contrasting beautifully with the cooler blue dress and scooter.\n\nPhotograph the scene with direct on-camera flash combined with the existing warm environmental lighting. Use saturated but natural colors, crisp flash highlights, subtle shadows, realistic skin texture, authentic fabric detail, and fine 35mm film grain. The final image should resemble a rare vintage Italian fashion editorial photographed for a contemporary luxury magazine.\n\nVertical 3:4 composition, full-body framing, realistic perspective, high-resolution photography, sophisticated color grading, tactile materials, natural anatomy, believable reflections, cinematic depth, premium editorial photography.\n\nAvoid: generic or minimalist café interiors, ordinary casual clothing, understated fashion, simple dresses, soft beauty lighting, artificial-looking skin, CGI appearance, illustration, anime, cartoon styling, distorted anatomy, malformed hands or feet, warped scooter geometry, unrealistic sidecar proportions, excessive blur, plastic textures, or an obviously AI-generated appearance.",
  "translations": {},
  "promptKind": "text-to-image",
  "inputRequirement": "No reference image required.",
  "categories": {
    "use": [
      "fashion-editorial"
    ],
    "style": [
      "photorealistic",
      "retro"
    ],
    "subject": [
      "people",
      "fashion"
    ]
  },
  "tags": [
    "Fashion Editorial",
    "1960s Italian",
    "On-Camera Flash",
    "Street"
  ],
  "media": [
    {
      "url": "https://pbs.twimg.com/media/HTY0mFjaoAAp8os?format=webp&name=large",
      "role": "output",
      "alt": "Original artwork 1 by @mehvishs25",
      "sourceUrl": "https://x.com/mehvishs25/status/2104927737014329524"
    },
    {
      "url": "https://pbs.twimg.com/media/HTY0nOlaEAAJ3jd.jpg",
      "role": "output",
      "alt": "Original artwork 2 by @mehvishs25",
      "sourceUrl": "https://x.com/mehvishs25/status/2104927737014329524"
    }
  ],
  "rights": {
    "basis": "third-party-source",
    "note": "Original prompts and artwork belong to their respective authors. Public source links; no blanket reuse license is granted."
  }
}
